{"$schema":"https://json-schema.org/draft/2020-12/schema","title":"Document Structure","type":"object","required":["schema_version","pages","paragraphs","tables","forms","reading_order"],"properties":{"schema_version":{"const":"document_structure/v1"},"pages":{"type":"array"},"headings":{"type":"array"},"paragraphs":{"type":"array"},"tables":{"type":"array"},"forms":{"type":"array"},"figures":{},"charts":{},"formulas":{},"reading_order":{"type":"array"},"layout_blocks":{"type":"array"}}}
